{
  "name": "ocx.sh/oven-sh/bun",
  "repository": "oci://ghcr.io/ocx-contrib/bun",
  "owners": [
    {
      "github": "alice",
      "github_id": 1
    }
  ],
  "status": "active",
  "deprecated_message": null,
  "created": "2026-07-10",
  "desc": null,
  "tags": {
    "1.2.0": {
      "content": "sha256:aaaaaaaaaaaaaaaaaaaaaaaaaaaaaaaaaaaaaaaaaaaaaaaaaaaaaaaaaaaaaaaa",
      "observed": "2026-07-17T00:00:00Z"
    }
  }
}
